{
  "id": "2026-08-15-example",
  "type": "post",
  "title": "Пам'ятаємо",
  "content": "Текст допису...",
  "media": [
    "media/posts/9559cc66-bd52-4d13-800c-e6fceababcdb.png",
    "media/posts/8296ada7-fccc-4b09-927d-90b7da8f9bed.png"
  ],
  "author": "moment_of_honor",
  "publishedAt": "2026-08-15T19:00:00.000Z",
  "updatedAt": "2026-08-17T10:16:01.683Z"
}
