{
  "id": "2026-09-13-7403f9ce",
  "type": "post",
  "title": "Як вшанувати полеглих захисників і захисниць у День памʼяті",
  "content": "29 серпня ми матимемо спільний День пам’яті, але кожен проживатиме його через пам’ять про конкретну людину: хтось через Хвилину мовчання, хтось через розмови про своїх, через Стіл пам’яті, виставки, забіги й інші дії, які допомагають не просто говорити про пам’ять, а робити її живою.\n\nУ колонці Катерина розповідає про вінкування: звідки походить ця жива традиція, чому пластиковий вінок змінив наше ставлення до пам’яті, що означає повернути собі власні способи вшанування та як кожен із нас може нести спільність 29 серпня.\n\nА ще — ділиться особистою історією: «Андрій, друг нашої сім’ї, загинув у травні 2022-го на останній вільній землі його рідної Луганщини. У пам’ять про нього я вплету у вінок блакитну квітку. Настільки блакитну, якими були його очі».\n\nПовний текст колонки Катерини Даценко — шукайте на сайті Lb.ua",
  "media": [
    "media/posts/61bf58a0-92f4-4b41-b83c-cdeee6fb731c.jpg",
    "media/posts/36465f92-e24a-4f35-b636-2c3dd28615e3.jpg",
    "media/posts/3863933e-d0ee-42a0-bdba-15cce21310bc.jpg",
    "media/posts/a04f93ad-7622-4565-a94a-d6e4f5e670d6.jpg",
    "media/posts/1dc77e05-3a84-43dc-bce5-8776f01aafb0.jpg"
  ],
  "author": "moment_of_honor",
  "publishedAt": "2026-09-12T23:46:00.000Z",
  "updatedAt": "2026-09-15T15:17:13.737Z"
}
