{
  "id": "2026-09-13-ea12f547",
  "type": "post",
  "title": "Де зародилась Хвилина мовчання?",
  "content": "Чи здатна одна хвилина змінити наше ставлення до тих, хто загинув, і до тих, хто продовжує жити? Як вона узагалі з’явилася? І що означає тиша для кожного з нас?\n\nВідповіді, історію виникнення і наново віднайдені історичні документи – шукайте на спільній виставці Вероніки Моль і Вшануй «Це може бути тиша» у Музеї війни.\n\nЕкспозиція триває до 27 вересня. Приходьте.\n\n📍 Музей Війни, Головний корпус (монумент “Батьківщина-мати”), Лаврська 27",
  "media": [
    "media/posts/3960c8e3-e620-4c89-8c70-a37cd0e25514.jpg",
    "media/posts/075447a2-7df1-4fdf-a2f8-55a983b0f668.jpg",
    "media/posts/dcc203b1-c8c1-4c32-aa68-4b1e652b0ad4.jpg",
    "media/posts/e3de4c02-1e75-4670-bce1-95a52591186b.jpg"
  ],
  "author": "moment_of_honor",
  "publishedAt": "2026-09-13T06:54:00.000Z",
  "updatedAt": "2026-09-13T12:58:00.136Z"
}
